{
  "schema_version": 1,
  "spec_version": "2.0.0-draft.1",
  "envelope_kind": "install-result",
  "operation": "uninstall",
  "outcome": "planned",
  "exit_code": 0,
  "status": "ok",
  "message": "planned removal of release 0.0.0-dev; nothing was changed",
  "retryable": false,
  "platform": "windows-x64",
  "host": {
    "os": "windows",
    "arch": "x86_64",
    "windows_version": "Microsoft Windows 11 Pro 10.0.26200",
    "powershell_version": "5.1.26100.9444",
    "session_elevated": true
  },
  "install_root": "D:\\SP-Billy\\axiom-worktrees\\axiom-cli-w10-j004\\_j004-run\\install-service",
  "bin_dir": "D:\\SP-Billy\\axiom-worktrees\\axiom-cli-w10-j004\\_j004-run\\install-service\\bin",
  "dry_run": true,
  "mutated": false,
  "plan_digest": "06b81257717d6afa8f8ad516dd79f2f63ecd33b417d7d909740b2f86b2cc7817",
  "approved_digest": null,
  "transaction_id": null,
  "interrupted_install_recovered": false,
  "release_set": null,
  "artifacts": [
    {
      "name": "axiom-cli.exe",
      "component": "axiom-cli",
      "version": "0.0.0-dev",
      "sha256": "8064f145f14bc6a66c6f24e9626922e94da65c14db3bf31287be751eef0eeed2",
      "size_bytes": 159232,
      "verified": true,
      "installed_path": "D:\\SP-Billy\\axiom-worktrees\\axiom-cli-w10-j004\\_j004-run\\install-service\\bin\\axiom-cli.exe",
      "source": "local-build"
    }
  ],
  "unverified_artifacts": [],
  "components": [
    {
      "component": "axiom-cli",
      "installed_version": "0.0.0-dev",
      "artifact_sha256": "8064f145f14bc6a66c6f24e9626922e94da65c14db3bf31287be751eef0eeed2",
      "version_source": "axiom-cli-install-state (recorded by the install transaction)"
    }
  ],
  "refusals": [],
  "path_rule": {
    "scope": "none",
    "registry_key": "HKCU\\Environment",
    "value_name": "Path",
    "entry": "",
    "applied": false,
    "machine_wide_change": false,
    "previous_present": false
  },
  "service_registration": {
    "kind": "scheduled-task-at-logon",
    "task_name": "AxiomCliJ004HarnessService",
    "owner": "axiom-cli",
    "registered": true,
    "removed": false,
    "reason": "planning only: the recorded managed-service registration is not removed until this plan is approved"
  },
  "preserved": [
    {
      "path": "D:\\SP-Billy\\axiom-worktrees\\axiom-cli-w10-j004\\_j004-run\\install-service",
      "reason": "planning only: nothing was removed and nothing was touched"
    }
  ],
  "removed": [],
  "elevation_required": false,
  "shell": "windows-powershell",
  "limitations": [
    "this uninstaller is the Windows x64 lane of the axiom-cli distribution; other delivery platforms are separate installers"
  ],
  "generated_at": "2026-09-20T09:58:50Z",
  "request_id": "axiom-cli-windows-2784-8df16fdc55f2f02"
}
