{
  "schema_version": 1,
  "spec_version": "2.0.0-draft.1",
  "envelope_kind": "install-result",
  "operation": "install",
  "outcome": "refused",
  "exit_code": 9,
  "status": "refused",
  "message": "refusing a downgrade from 0.0.0-dev to 0.0.0-alpha",
  "retryable": false,
  "platform": "windows-x64",
  "host": {
    "os": "windows",
    "arch": "x86_64",
    "windows_version": "Microsoft Windows 11 Pro 10.0.26200",
    "powershell_version": "5.1.26100.9444",
    "session_elevated": true
  },
  "install_root": "D:\\SP-Billy\\axiom-worktrees\\axiom-cli-w10-j004\\_j004-run\\install-downgrade",
  "bin_dir": "D:\\SP-Billy\\axiom-worktrees\\axiom-cli-w10-j004\\_j004-run\\install-downgrade\\bin",
  "dry_run": true,
  "mutated": false,
  "plan_digest": "dd75815285ec6f02b44bcebb2be5512b13655f8dd4a0e37cb24175492780ad77",
  "approved_digest": "dd75815285ec6f02b44bcebb2be5512b13655f8dd4a0e37cb24175492780ad77",
  "transaction_id": "txn-20260920T095831-fc12813b",
  "interrupted_install_recovered": false,
  "release_set": {
    "path": "D:\\SP-Billy\\axiom-worktrees\\axiom-cli-w10-j004\\_j004-run\\release-set-alpha\\release-set.json",
    "sha256": "dd75815285ec6f02b44bcebb2be5512b13655f8dd4a0e37cb24175492780ad77",
    "release_version": "0.0.0-alpha"
  },
  "artifacts": [
    {
      "name": "axiom-cli.exe",
      "component": "axiom-cli",
      "version": "0.0.0-alpha",
      "sha256": "8064f145f14bc6a66c6f24e9626922e94da65c14db3bf31287be751eef0eeed2",
      "size_bytes": 159232,
      "verified": true,
      "installed_path": null,
      "source": "local-build"
    }
  ],
  "unverified_artifacts": [
    {
      "name": "axiom-graphd",
      "component": "axiom-graphd",
      "reason": "axiom-graphd: no artifact for this component is carried by the release set (no axiom-graphd core manifest was read at assembly time, so this release set makes no claim about the core release state)"
    },
    {
      "name": "axiom",
      "component": "axiom",
      "reason": "axiom: no artifact for this component is carried by the release set (no axiom-graphd core manifest was read at assembly time, so this release set makes no claim about the core release state)"
    },
    {
      "name": "axiom-mcp",
      "component": "axiom-mcp",
      "reason": "axiom-mcp: this release set declares no version source it can verify and carries no artifact for it"
    },
    {
      "name": "skills",
      "component": "skills",
      "reason": "skills: this release set declares no version source it can verify and carries no artifact for it"
    }
  ],
  "components": [
    {
      "component": "axiom-cli",
      "installed_version": "0.0.0-alpha",
      "artifact_sha256": "8064f145f14bc6a66c6f24e9626922e94da65c14db3bf31287be751eef0eeed2",
      "version_source": "release-set.json (sha256 dd75815285ec6f02b44bcebb2be5512b13655f8dd4a0e37cb24175492780ad77)"
    }
  ],
  "refusals": [
    {
      "check": "no-downgrade",
      "artifact": "D:\\SP-Billy\\axiom-worktrees\\axiom-cli-w10-j004\\_j004-run\\release-set-alpha\\release-set.json",
      "expected_sha256": "0.0.0-dev",
      "actual_sha256": "0.0.0-alpha",
      "reason": "release 0.0.0-alpha is older than the installed 0.0.0-dev; pass -AllowDowngrade to proceed"
    }
  ],
  "path_rule": {
    "scope": "none",
    "registry_key": "HKCU\\Environment",
    "value_name": "Path",
    "entry": "",
    "applied": false,
    "machine_wide_change": false,
    "previous_present": false
  },
  "service_registration": {
    "kind": "none",
    "task_name": null,
    "owner": null,
    "registered": false,
    "removed": false,
    "reason": "no managed-service registration is recorded by this envelope"
  },
  "preserved": [],
  "removed": [],
  "elevation_required": false,
  "shell": "windows-powershell",
  "limitations": [
    "this installer is the Windows x64 lane of the axiom-cli distribution; other delivery platforms are separate installers and are not exercised here",
    "the pinned core release is not built (no axiom-graphd core manifest was read at assembly time, so this release set makes no claim about the core release state), so axiom-graphd.exe and axiom.exe are not carried by this release set and are recorded as unverified rather than installed",
    "this release set is assembled from a local build; it is not a published release and carries no signature. Publication, signing and the update channel are owned by separate tasks",
    "the installation engine, the daemon service lifecycle and the per-component update transaction stay owned by axiom-graphd; this release set wraps them and never re-implements them"
  ],
  "generated_at": "2026-09-20T09:58:31Z",
  "request_id": "axiom-cli-windows-38320-8df16fdb9e70195"
}
