{
  "schema_version": 1,
  "spec_version": "2.0.0-draft.1",
  "envelope_kind": "install-result",
  "operation": "install",
  "outcome": "already_installed",
  "exit_code": 0,
  "status": "ok",
  "message": "release 0.0.0-dev is already installed at D:\\SP-Billy\\axiom-worktrees\\axiom-cli-w10-j004\\_j004-run\\install-main with matching digests; nothing changed",
  "retryable": false,
  "platform": "windows-x64",
  "host": {
    "os": "windows",
    "arch": "x86_64",
    "windows_version": "Microsoft Windows 11 Pro 10.0.26200",
    "powershell_version": "5.1.26100.9444",
    "session_elevated": true
  },
  "install_root": "D:\\SP-Billy\\axiom-worktrees\\axiom-cli-w10-j004\\_j004-run\\install-main",
  "bin_dir": "D:\\SP-Billy\\axiom-worktrees\\axiom-cli-w10-j004\\_j004-run\\install-main\\bin",
  "dry_run": true,
  "mutated": false,
  "plan_digest": "5608ec2b6ce48b545641babc6ed8f4e9740f298922e6eed7b606ace744cd8e1d",
  "approved_digest": "5608ec2b6ce48b545641babc6ed8f4e9740f298922e6eed7b606ace744cd8e1d",
  "transaction_id": "txn-20260920T095824-bb2cf4ed",
  "interrupted_install_recovered": false,
  "release_set": {
    "path": "D:\\SP-Billy\\axiom-worktrees\\axiom-cli-w10-j004\\_j004-run\\release-set-main\\release-set.json",
    "sha256": "5608ec2b6ce48b545641babc6ed8f4e9740f298922e6eed7b606ace744cd8e1d",
    "release_version": "0.0.0-dev"
  },
  "artifacts": [
    {
      "name": "axiom-cli.exe",
      "component": "axiom-cli",
      "version": "0.0.0-dev",
      "sha256": "8064f145f14bc6a66c6f24e9626922e94da65c14db3bf31287be751eef0eeed2",
      "size_bytes": 159232,
      "verified": true,
      "installed_path": "D:\\SP-Billy\\axiom-worktrees\\axiom-cli-w10-j004\\_j004-run\\install-main\\bin\\axiom-cli.exe",
      "source": "local-build"
    }
  ],
  "unverified_artifacts": [
    {
      "name": "axiom-graphd",
      "component": "axiom-graphd",
      "reason": "axiom-graphd: no artifact for this component is carried by the release set (no axiom-graphd core manifest was read at assembly time, so this release set makes no claim about the core release state)"
    },
    {
      "name": "axiom",
      "component": "axiom",
      "reason": "axiom: no artifact for this component is carried by the release set (no axiom-graphd core manifest was read at assembly time, so this release set makes no claim about the core release state)"
    },
    {
      "name": "axiom-mcp",
      "component": "axiom-mcp",
      "reason": "axiom-mcp: this release set declares no version source it can verify and carries no artifact for it"
    },
    {
      "name": "skills",
      "component": "skills",
      "reason": "skills: this release set declares no version source it can verify and carries no artifact for it"
    }
  ],
  "components": [
    {
      "component": "axiom-cli",
      "installed_version": "0.0.0-dev",
      "artifact_sha256": "8064f145f14bc6a66c6f24e9626922e94da65c14db3bf31287be751eef0eeed2",
      "version_source": "release-set.json (sha256 5608ec2b6ce48b545641babc6ed8f4e9740f298922e6eed7b606ace744cd8e1d)"
    }
  ],
  "refusals": [],
  "path_rule": {
    "scope": "user",
    "registry_key": "HKCU\\Environment",
    "value_name": "Path",
    "entry": "D:\\SP-Billy\\axiom-worktrees\\axiom-cli-w10-j004\\_j004-run\\install-main\\bin",
    "applied": true,
    "machine_wide_change": false,
    "previous_present": true
  },
  "service_registration": {
    "kind": "none",
    "task_name": null,
    "owner": null,
    "registered": false,
    "removed": false,
    "reason": "no managed-service registration is recorded by this envelope"
  },
  "preserved": [
    {
      "path": "D:\\SP-Billy\\axiom-worktrees\\axiom-cli-w10-j004\\_j004-run\\install-main",
      "reason": "an idempotent re-run changes nothing: the recorded generation is kept in place"
    }
  ],
  "removed": [],
  "elevation_required": false,
  "shell": "windows-powershell",
  "limitations": [
    "this installer is the Windows x64 lane of the axiom-cli distribution; other delivery platforms are separate installers and are not exercised here",
    "the pinned core release is not built (no axiom-graphd core manifest was read at assembly time, so this release set makes no claim about the core release state), so axiom-graphd.exe and axiom.exe are not carried by this release set and are recorded as unverified rather than installed",
    "this release set is assembled from a local build; it is not a published release and carries no signature. Publication, signing and the update channel are owned by separate tasks",
    "the installation engine, the daemon service lifecycle and the per-component update transaction stay owned by axiom-graphd; this release set wraps them and never re-implements them"
  ],
  "generated_at": "2026-09-20T09:58:24Z",
  "request_id": "axiom-cli-windows-32304-8df16fdb5f1a00c"
}
