{
  "schema_version": 1,
  "spec_version": "2.0.0-draft.1",
  "envelope_kind": "install-result",
  "operation": "uninstall",
  "outcome": "not_removed",
  "exit_code": 3,
  "status": "refused",
  "message": "no axiom-cli install state at D:\\SP-Billy\\axiom-worktrees\\axiom-cli-w10-j004\\_j004-run\\install-main\\cli\\state.json; nothing to remove",
  "retryable": false,
  "platform": "windows-x64",
  "host": {
    "os": "windows",
    "arch": "x86_64",
    "windows_version": "Microsoft Windows 11 Pro 10.0.26200",
    "powershell_version": "5.1.26100.9444",
    "session_elevated": true
  },
  "install_root": "D:\\SP-Billy\\axiom-worktrees\\axiom-cli-w10-j004\\_j004-run\\install-main",
  "bin_dir": "D:\\SP-Billy\\axiom-worktrees\\axiom-cli-w10-j004\\_j004-run\\install-main\\bin",
  "dry_run": true,
  "mutated": false,
  "plan_digest": null,
  "approved_digest": null,
  "transaction_id": null,
  "interrupted_install_recovered": false,
  "release_set": null,
  "artifacts": [],
  "unverified_artifacts": [],
  "components": [],
  "refusals": [],
  "path_rule": {
    "scope": "none",
    "registry_key": "HKCU\\Environment",
    "value_name": "Path",
    "entry": "",
    "applied": false,
    "machine_wide_change": false,
    "previous_present": false
  },
  "service_registration": {
    "kind": "none",
    "task_name": null,
    "owner": null,
    "registered": false,
    "removed": false,
    "reason": "no managed-service registration is recorded by this envelope"
  },
  "preserved": [
    {
      "path": "D:\\SP-Billy\\axiom-worktrees\\axiom-cli-w10-j004\\_j004-run\\install-main",
      "reason": "nothing is installed here, so nothing was removed and nothing was touched"
    }
  ],
  "removed": [],
  "elevation_required": false,
  "shell": "windows-powershell",
  "limitations": [
    "this uninstaller is the Windows x64 lane of the axiom-cli distribution; other delivery platforms are separate installers"
  ],
  "generated_at": "2026-09-20T09:52:07Z",
  "request_id": "axiom-cli-windows-21520-8df16fcd53a547b"
}
